### DISCUSSION TITLE
git fatal error -  could not read Username for

### DISCUSSION THREAD

**Discussion by snatch2013** [requarks/wiki#5387] [Error / Bug Report]
Hello,

I am trying to add a git backup. I see that the local repository is updated, after any change there is a new commit. But for some reason wiki.js doesn't push to the remote repository.

In the status field there is always this error:
fatal: could not read Username for 'https://scmmanager.mysite.com': No such device or address error: Could not fetch origin

If I go to the directory ./data/repo and run under the user _wiki_ this command
`git push --set-upstream origin master`
push is successfull and I see a new commit on the remote server.

In tcpdump I see, that wiki.js makes a GET request for /scm/repo/Databases/wiki_backup/info/refs?service=git-receive-pack
But what is strange for me is that I don't see any authentication field in this request.

Frame 4: 363 bytes on wire (2904 bits), 363 bytes captured (2904 bits)
Ethernet II, Src: 9e:27:57:73:bd:00 (9e:27:57:73:bd:00), Dst: ae:8d:29:3d:3f:0a (ae:8d:29:3d:3f:0a)
Internet Protocol Version 4, Src: 172.16.115.20, Dst: 172.16.115.100
Transmission Control Protocol, Src Port: 50670, Dst Port: 8080, Seq: 1, Ack: 1, Len: 297
Hypertext Transfer Protocol
    GET /scm/repo/Databases/wiki_backup/info/refs?service=git-receive-pack HTTP/1.0\r\n
        [Expert Info (Chat/Sequence): GET /scm/repo/Databases/wiki_backup/info/refs?service=git-receive-pack HTTP/1.0\r\n]
            [GET /scm/repo/Databases/wiki_backup/info/refs?service=git-receive-pack HTTP/1.0\r\n]
            [Severity level: Chat]
            [Group: Sequence]
        Request Method: GET
        Request URI: /scm/repo/Databases/wiki_backup/info/refs?service=git-receive-pack
            Request URI Path: /scm/repo/Databases/wiki_backup/info/refs
            Request URI Query: service=git-receive-pack
                Request URI Query Parameter: service=git-receive-pack
        Request Version: HTTP/1.0
    Host: scmmanager.mysite.com\r\n
    X-Real-IP: 172.16.115.1\r\n
    X-Forwarded-For: 172.16.115.1\r\n
    X-Forwarded-Proto: https\r\n
    Connection: close\r\n
    User-Agent: git/2.17.1\r\n
    Accept: */*\r\n
    Accept-Encoding: gzip\r\n
    Pragma: no-cache\r\n
    \r\n
    [Full request URI: http://scmmanager.mysite.com/scm/repo/Databases/wiki_backup/info/refs?service=git-receive-pack]
    [HTTP request 1/1]
    [Response in frame: 6]

In the settings for git storage I have configure a basic authentication. Wiki.js version is 2.5.283, installed in Ubuntu.

Sorry if my report is not structured correctly or if I forgot some important information.

**Comment by snatch2013** [comment]
so, as a workaround, I have just added to the crown a command " cd /var/www/wiki/repo && git push origin master" and it works like this.
